[2016-12-30 20:39:13,195 INFO  L116           UltimateCore]: Initializing application
[2016-12-30 20:39:13,197 INFO  L121           UltimateCore]: --------------------------------------------------------------------------------
[2016-12-30 20:39:13,202 INFO  L91           PluginFactory]: --------------------------------------------------------------------------------
[2016-12-30 20:39:13,202 INFO  L92           PluginFactory]: Detecting plugins...
[2016-12-30 20:39:13,203 INFO  L339          PluginFactory]: 1 IController plugins available
[2016-12-30 20:39:13,204 INFO  L339          PluginFactory]: 5 ISource plugins available
[2016-12-30 20:39:13,204 INFO  L339          PluginFactory]: 2 IOutput plugins available
[2016-12-30 20:39:13,205 INFO  L339          PluginFactory]: 12 IGenerator plugins available
[2016-12-30 20:39:13,206 INFO  L339          PluginFactory]: 6 IAnalysis plugins available
[2016-12-30 20:39:13,210 INFO  L292          PluginFactory]: Loaded controller Ultimate Commandline Interface
[2016-12-30 20:39:13,211 INFO  L99           PluginFactory]: Finished detecting plugins!
[2016-12-30 20:39:13,211 INFO  L100          PluginFactory]: Loading services ...
[2016-12-30 20:39:13,212 INFO  L323          PluginFactory]: 0 IServiceFactory services available
[2016-12-30 20:39:13,212 INFO  L102          PluginFactory]: Finished loading services!
[2016-12-30 20:39:13,212 INFO  L103          PluginFactory]: --------------------------------------------------------------------------------
[2016-12-30 20:39:13,214 INFO  L158           UltimateCore]: Initializing controller ...
[2016-12-30 20:39:13,339 INFO  L196          PluginFactory]: --------------------------------------------------------------------------------
[2016-12-30 20:39:13,340 INFO  L197          PluginFactory]: Loading all admissible plugins (creating one instance, loading preferences)
[2016-12-30 20:39:13,986 INFO  L218          PluginFactory]: Finished loading 25 admissible plugins (all were admissible)
[2016-12-30 20:39:13,987 INFO  L220          PluginFactory]: --------------------------------------------------------------------------------
[2016-12-30 20:39:14,557 INFO  L170        SettingsManager]: Resetting all preferences to default values...
[2016-12-30 20:39:14,557 INFO  L174        SettingsManager]: Resetting Boogie Modifies Set Annotator preferences to default values
[2016-12-30 20:39:14,562 INFO  L174        SettingsManager]: Resetting Boogie Preprocessor preferences to default values
[2016-12-30 20:39:14,563 INFO  L174        SettingsManager]: Resetting Boogie Procedure Inliner preferences to default values
[2016-12-30 20:39:14,564 INFO  L174        SettingsManager]: Resetting Abstract Interpretation preferences to default values
[2016-12-30 20:39:14,567 INFO  L174        SettingsManager]: Resetting IRS Dependencies preferences to default values
[2016-12-30 20:39:14,568 INFO  L174        SettingsManager]: Resetting LassoRanker preferences to default values
[2016-12-30 20:39:14,571 INFO  L177        SettingsManager]: Büchi Program Product provides no preferences, ignoring...
[2016-12-30 20:39:14,572 INFO  L174        SettingsManager]: Resetting HeapSeparator preferences to default values
[2016-12-30 20:39:14,573 INFO  L174        SettingsManager]: Resetting LTL2Aut preferences to default values
[2016-12-30 20:39:14,574 INFO  L174        SettingsManager]: Resetting BlockEncodingV2 preferences to default values
[2016-12-30 20:39:14,576 INFO  L174        SettingsManager]: Resetting AutomataScriptInterpreter preferences to default values
[2016-12-30 20:39:14,577 INFO  L174        SettingsManager]: Resetting BlockEncoding preferences to default values
[2016-12-30 20:39:14,578 INFO  L174        SettingsManager]: Resetting BuchiAutomizer preferences to default values
[2016-12-30 20:39:14,580 INFO  L174        SettingsManager]: Resetting CACSL2BoogieTranslator preferences to default values
[2016-12-30 20:39:14,582 INFO  L174        SettingsManager]: Resetting CodeCheck preferences to default values
[2016-12-30 20:39:14,591 INFO  L174        SettingsManager]: Resetting RCFGBuilder preferences to default values
[2016-12-30 20:39:14,597 INFO  L174        SettingsManager]: Resetting TraceAbstraction preferences to default values
[2016-12-30 20:39:14,599 INFO  L177        SettingsManager]: TraceAbstractionConcurrent provides no preferences, ignoring...
[2016-12-30 20:39:14,599 INFO  L174        SettingsManager]: Resetting Boogie Printer preferences to default values
[2016-12-30 20:39:14,600 INFO  L174        SettingsManager]: Resetting Witness Printer preferences to default values
[2016-12-30 20:39:14,601 INFO  L177        SettingsManager]: AutomataScriptParser provides no preferences, ignoring...
[2016-12-30 20:39:14,601 INFO  L177        SettingsManager]: Boogie PL CUP Parser provides no preferences, ignoring...
[2016-12-30 20:39:14,601 INFO  L174        SettingsManager]: Resetting CDTParser preferences to default values
[2016-12-30 20:39:14,602 INFO  L174        SettingsManager]: Resetting LTL2Aut preferences to default values
[2016-12-30 20:39:14,603 INFO  L174        SettingsManager]: Resetting Witness Parser preferences to default values
[2016-12-30 20:39:14,604 INFO  L174        SettingsManager]: Resetting UltimateCore preferences to default values
[2016-12-30 20:39:14,627 INFO  L177        SettingsManager]: Ultimate Commandline Interface provides no preferences, ignoring...
[2016-12-30 20:39:14,629 INFO  L181        SettingsManager]: Finished resetting all preferences to default values...
[2016-12-30 20:39:14,630 INFO  L98         SettingsManager]: Beginning loading settings from /home/hussama/williame/svcomp/depthk2/modules/UAutomizer/svcomp-Termination-64bit-Automizer_Default.epf
[2016-12-30 20:39:14,652 INFO  L110        SettingsManager]: Loading preferences was successful
[2016-12-30 20:39:14,660 INFO  L112        SettingsManager]: Preferences different from defaults after loading the file:
[2016-12-30 20:39:14,662 INFO  L131        SettingsManager]: Preferences of BuchiAutomizer differ from their defaults:
[2016-12-30 20:39:14,662 INFO  L133        SettingsManager]:  * Use old map elimination=false
[2016-12-30 20:39:14,662 INFO  L133        SettingsManager]:  * Use external solver (rank synthesis)=false
[2016-12-30 20:39:14,663 INFO  L133        SettingsManager]:  * Use only trivial implications for array writes=true
[2016-12-30 20:39:14,663 INFO  L133        SettingsManager]:  * Rank analysis=LINEAR_WITH_GUESSES
[2016-12-30 20:39:14,663 INFO  L131        SettingsManager]: Preferences of CACSL2BoogieTranslator differ from their defaults:
[2016-12-30 20:39:14,664 INFO  L133        SettingsManager]:  * Check unreachability of error function in SV-COMP mode=false
[2016-12-30 20:39:14,664 INFO  L133        SettingsManager]:  * Overapproximate operations on floating types=true
[2016-12-30 20:39:14,664 INFO  L133        SettingsManager]:  * Check division by zero=IGNORE
[2016-12-30 20:39:14,664 INFO  L133        SettingsManager]:  * Pointer to allocated memory at dereference=ASSUME
[2016-12-30 20:39:14,665 INFO  L133        SettingsManager]:  * If two pointers are subtracted or compared they have the same base address=ASSUME
[2016-12-30 20:39:14,666 INFO  L133        SettingsManager]:  * Check array bounds for arrays that are off heap=ASSUME
[2016-12-30 20:39:14,666 INFO  L133        SettingsManager]:  * Check if freed pointer was valid=false
[2016-12-30 20:39:14,666 INFO  L133        SettingsManager]:  * Assume nondeterminstic values are in range=false
[2016-12-30 20:39:14,667 INFO  L133        SettingsManager]:  * Pointer base address is valid at dereference=ASSUME
[2016-12-30 20:39:14,667 INFO  L131        SettingsManager]: Preferences of RCFGBuilder differ from their defaults:
[2016-12-30 20:39:14,667 INFO  L133        SettingsManager]:  * Size of a code block=SequenceOfStatements
[2016-12-30 20:39:14,667 INFO  L133        SettingsManager]:  * Convert code blocks to CNF=false
[2016-12-30 20:39:14,668 INFO  L133        SettingsManager]:  * To the following directory=/home/matthias/ultimate/dump
[2016-12-30 20:39:14,668 INFO  L131        SettingsManager]: Preferences of TraceAbstraction differ from their defaults:
[2016-12-30 20:39:14,668 INFO  L133        SettingsManager]:  * Dump automata to the following directory=/home/matthias/ultimate/dump/auto
[2016-12-30 20:39:14,710 INFO  L81    nceAwareModelManager]: Repository-Root is: /tmp
[2016-12-30 20:39:14,717 INFO  L444   ainManager$Toolchain]: [Toolchain 1]: Parser CDTParser is usable for /home/hussama/williame/svcomp/sv-benchmarks/c/termination-crafted/Arrays02-EquivalentConstantIndices_false-termination_true-valid-memsafety.c
[2016-12-30 20:39:14,718 INFO  L237   ainManager$Toolchain]: [Toolchain 1]: Parser(s) successfully initiated...
[2016-12-30 20:39:14,723 INFO  L214   ainManager$Toolchain]: [Toolchain 1]: Toolchain data selected.
[2016-12-30 20:39:14,725 INFO  L277        PluginConnector]: Initializing CDTParser...
[2016-12-30 20:39:14,725 INFO  L282        PluginConnector]: CDTParser initialized
[2016-12-30 20:39:14,726 INFO  L384   ainManager$Toolchain]: [Toolchain 1]: Parsing single file: /home/hussama/williame/svcomp/sv-benchmarks/c/termination-crafted/Arrays02-EquivalentConstantIndices_false-termination_true-valid-memsafety.c
[2016-12-30 20:39:14,882 INFO  L263   ainManager$Toolchain]: ####################### [Toolchain 1] #######################
[2016-12-30 20:39:14,884 INFO  L128        ToolchainWalker]: Walking toolchain with 5 elements.
[2016-12-30 20:39:14,886 INFO  L114        PluginConnector]: ------------------------CACSL2BoogieTranslator----------------------------
[2016-12-30 20:39:14,886 INFO  L277        PluginConnector]: Initializing CACSL2BoogieTranslator...
[2016-12-30 20:39:14,894 INFO  L282        PluginConnector]: CACSL2BoogieTranslator initialized
[2016-12-30 20:39:14,896 INFO  L187        PluginConnector]: Executing the observer ACSLObjectContainerObserver from plugin CACSL2BoogieTranslator for "CDTParser AST 30.12 08:39:14" (1/1) ...
[2016-12-30 20:39:14,901 INFO  L207        PluginConnector]: Invalid model from CACSL2BoogieTranslator for observer de.uni_freiburg.informatik.ultimate.plugins.generator.cacsl2boogietranslator.ACSLObjectContainerObserver@6eccd999 and model type de.uni_freiburg.informatik.ultimate.plugins.generator.cacsl2boogietranslator AST 30.12 08:39:14, skipping insertion in model container
[2016-12-30 20:39:14,901 INFO  L187        PluginConnector]: Executing the observer CACSL2BoogieTranslatorObserver from plugin CACSL2BoogieTranslator for "CDTParser AST 30.12 08:39:14" (1/1) ...
[2016-12-30 20:39:14,913 INFO  L220   ieTranslatorObserver]: Settings: SV_COMP14
[2016-12-30 20:39:15,119 INFO  L440          PostProcessor]: Settings: Checked method=main
[2016-12-30 20:39:15,144 INFO  L440          PostProcessor]: Settings: Checked method=main
[2016-12-30 20:39:15,154 INFO  L204        PluginConnector]: Adding new model de.uni_freiburg.informatik.ultimate.plugins.generator.cacsl2boogietranslator AST 30.12 08:39:15 WrapperNode
[2016-12-30 20:39:15,154 INFO  L134        PluginConnector]: ------------------------ END CACSL2BoogieTranslator----------------------------
[2016-12-30 20:39:15,155 INFO  L114        PluginConnector]: ------------------------Boogie Procedure Inliner----------------------------
[2016-12-30 20:39:15,155 INFO  L277        PluginConnector]: Initializing Boogie Procedure Inliner...
[2016-12-30 20:39:15,155 INFO  L282        PluginConnector]: Boogie Procedure Inliner initialized
[2016-12-30 20:39:15,163 INFO  L187        PluginConnector]: Executing the observer TypeChecker from plugin Boogie Procedure Inliner for "de.uni_freiburg.informatik.ultimate.plugins.generator.cacsl2boogietranslator AST 30.12 08:39:15" (1/1) ...
[2016-12-30 20:39:15,170 INFO  L187        PluginConnector]: Executing the observer Inliner from plugin Boogie Procedure Inliner for "de.uni_freiburg.informatik.ultimate.plugins.generator.cacsl2boogietranslator AST 30.12 08:39:15" (1/1) ...
[2016-12-30 20:39:15,181 INFO  L134        PluginConnector]: ------------------------ END Boogie Procedure Inliner----------------------------
[2016-12-30 20:39:15,182 INFO  L114        PluginConnector]: ------------------------Boogie Preprocessor----------------------------
[2016-12-30 20:39:15,182 INFO  L277        PluginConnector]: Initializing Boogie Preprocessor...
[2016-12-30 20:39:15,182 INFO  L282        PluginConnector]: Boogie Preprocessor initialized
[2016-12-30 20:39:15,189 INFO  L187        PluginConnector]: Executing the observer TypeChecker from plugin Boogie Preprocessor for "de.uni_freiburg.informatik.ultimate.plugins.generator.cacsl2boogietranslator AST 30.12 08:39:15" (1/1) ...
[2016-12-30 20:39:15,190 INFO  L187        PluginConnector]: Executing the observer ConstExpander from plugin Boogie Preprocessor for "de.uni_freiburg.informatik.ultimate.plugins.generator.cacsl2boogietranslator AST 30.12 08:39:15" (1/1) ...
[2016-12-30 20:39:15,190 INFO  L187        PluginConnector]: Executing the observer StructExpander from plugin Boogie Preprocessor for "de.uni_freiburg.informatik.ultimate.plugins.generator.cacsl2boogietranslator AST 30.12 08:39:15" (1/1) ...
[2016-12-30 20:39:15,190 INFO  L187        PluginConnector]: Executing the observer UnstructureCode from plugin Boogie Preprocessor for "de.uni_freiburg.informatik.ultimate.plugins.generator.cacsl2boogietranslator AST 30.12 08:39:15" (1/1) ...
[2016-12-30 20:39:15,193 INFO  L187        PluginConnector]: Executing the observer FunctionInliner from plugin Boogie Preprocessor for "de.uni_freiburg.informatik.ultimate.plugins.generator.cacsl2boogietranslator AST 30.12 08:39:15" (1/1) ...
[2016-12-30 20:39:15,194 INFO  L187        PluginConnector]: Executing the observer BoogieSymbolTableConstructor from plugin Boogie Preprocessor for "de.uni_freiburg.informatik.ultimate.plugins.generator.cacsl2boogietranslator AST 30.12 08:39:15" (1/1) ...
[2016-12-30 20:39:15,195 INFO  L134        PluginConnector]: ------------------------ END Boogie Preprocessor----------------------------
[2016-12-30 20:39:15,195 INFO  L114        PluginConnector]: ------------------------RCFGBuilder----------------------------
[2016-12-30 20:39:15,195 INFO  L277        PluginConnector]: Initializing RCFGBuilder...
[2016-12-30 20:39:15,195 INFO  L282        PluginConnector]: RCFGBuilder initialized
[2016-12-30 20:39:15,196 INFO  L187        PluginConnector]: Executing the observer RCFGBuilderObserver from plugin RCFGBuilder for "de.uni_freiburg.informatik.ultimate.plugins.generator.cacsl2boogietranslator AST 30.12 08:39:15" (1/1) ...
[2016-12-30 20:39:15,251 INFO  L212       MonitoredProcess]: Starting monitored process 1 with z3 SMTLIB2_COMPLIANT=true -memory:1024 -smt2 -in -t:12000 (exit command is (exit), workingDir is null)
[2016-12-30 20:39:15,258 INFO  L303       MonitoredProcess]: Waiting until toolchain timeout for monitored process 1 with z3 SMTLIB2_COMPLIANT=true -memory:1024 -smt2 -in -t:12000
[2016-12-30 20:39:15,291 INFO  L128     BoogieDeclarations]: Found specification of procedure ULTIMATE.start
[2016-12-30 20:39:15,292 INFO  L136     BoogieDeclarations]: Found implementation of procedure ULTIMATE.start
[2016-12-30 20:39:15,379 INFO  L260             CfgBuilder]: Using the 1 location(s) as analysis (start of procedure ULTIMATE.start)
[2016-12-30 20:39:15,380 INFO  L204        PluginConnector]: Adding new model de.uni_freiburg.informatik.ultimate.plugins.generator.rcfgbuilder CFG 30.12 08:39:15 BoogieIcfgContainer
[2016-12-30 20:39:15,380 INFO  L134        PluginConnector]: ------------------------ END RCFGBuilder----------------------------
[2016-12-30 20:39:15,381 INFO  L114        PluginConnector]: ------------------------BuchiAutomizer----------------------------
[2016-12-30 20:39:15,381 INFO  L277        PluginConnector]: Initializing BuchiAutomizer...
[2016-12-30 20:39:15,381 INFO  L282        PluginConnector]: BuchiAutomizer initialized
[2016-12-30 20:39:15,382 INFO  L99          BuchiAutomizer]: Safety of program was proven or not checked, starting termination analysis
[2016-12-30 20:39:15,386 INFO  L187        PluginConnector]: Executing the observer BuchiAutomizerObserver from plugin BuchiAutomizer for "de.uni_freiburg.informatik.ultimate.plugins.generator.rcfgbuilder CFG 30.12 08:39:15" (1/1) ...
[2016-12-30 20:39:15,435 INFO  L353         BuchiCegarLoop]: Interprodecural is true
[2016-12-30 20:39:15,435 INFO  L354         BuchiCegarLoop]: Hoare is false
[2016-12-30 20:39:15,435 INFO  L355         BuchiCegarLoop]: Compute interpolants for ForwardPredicates
[2016-12-30 20:39:15,435 INFO  L356         BuchiCegarLoop]: Backedges is CANONICAL
[2016-12-30 20:39:15,435 INFO  L357         BuchiCegarLoop]: Determinization is PREDICATE_ABSTRACTION
[2016-12-30 20:39:15,436 INFO  L358         BuchiCegarLoop]: Difference is false
[2016-12-30 20:39:15,436 INFO  L359         BuchiCegarLoop]: Minimize is MINIMIZE_SEVPA
[2016-12-30 20:39:15,436 INFO  L362         BuchiCegarLoop]: ======== Iteration 0==of CEGAR loop == BuchiCegarLoop========
[2016-12-30 20:39:15,437 INFO  L86    2NestedWordAutomaton]: Mode: main mode - execution starts in main procedure
[2016-12-30 20:39:15,449 INFO  L72            BuchiIsEmpty]: Start BuchiIsEmpty. Operand 8 states.
[2016-12-30 20:39:15,475 INFO  L101         SccComputation]: Graph consists of 1 InCaSumBalls and 5 non ball SCCs. Number of states in SCCs 8.
[2016-12-30 20:39:15,476 INFO  L132   ngComponentsAnalysis]: Automaton has 1 accepting balls. 3
[2016-12-30 20:39:15,476 INFO  L87            BuchiIsEmpty]: Finished BuchiIsEmpty Result is false
[2016-12-30 20:39:15,476 INFO  L124           BuchiIsEmpty]: Starting construction of run
[2016-12-30 20:39:15,484 INFO  L694         BuchiCegarLoop]: Counterexample stem histogram [1]
[2016-12-30 20:39:15,485 INFO  L696         BuchiCegarLoop]: Counterexample loop histogram [1, 1, 1]
[2016-12-30 20:39:15,485 INFO  L392         BuchiCegarLoop]: ======== Iteration 1============
[2016-12-30 20:39:15,485 INFO  L72            BuchiIsEmpty]: Start BuchiIsEmpty. Operand 8 states.
[2016-12-30 20:39:15,486 INFO  L101         SccComputation]: Graph consists of 1 InCaSumBalls and 5 non ball SCCs. Number of states in SCCs 8.
[2016-12-30 20:39:15,486 INFO  L132   ngComponentsAnalysis]: Automaton has 1 accepting balls. 3
[2016-12-30 20:39:15,486 INFO  L87            BuchiIsEmpty]: Finished BuchiIsEmpty Result is false
[2016-12-30 20:39:15,487 INFO  L124           BuchiIsEmpty]: Starting construction of run
[2016-12-30 20:39:15,487 INFO  L694         BuchiCegarLoop]: Counterexample stem histogram [1]
[2016-12-30 20:39:15,487 INFO  L696         BuchiCegarLoop]: Counterexample loop histogram [1, 1, 1]
[2016-12-30 20:39:15,502 INFO  L316   ker$LassoCheckResult]: Stem: 9#ULTIMATE.startENTRYtrue havoc main_#res;havoc main_#t~nondet0, main_~a~2;havoc main_~a~2; 7#L10'''true 
[2016-12-30 20:39:15,502 INFO  L318   ker$LassoCheckResult]: Loop: 7#L10'''true assume true; 8#L10true assume true; 5#L10'true assume !!(main_~a~2[2] >= 0);assume true;assume true;main_~a~2 := main_~a~2[2 := main_~a~2[2] - 1];assume true;main_~a~2 := main_~a~2[2 := main_#t~nondet0];havoc main_#t~nondet0; 7#L10'''true 
[2016-12-30 20:39:15,522 INFO  L145    AnnotateAndAsserter]: Conjunction of SSA is sat
[2016-12-30 20:39:15,540 INFO  L145    AnnotateAndAsserter]: Conjunction of SSA is sat
[2016-12-30 20:39:15,571 INFO  L145    AnnotateAndAsserter]: Conjunction of SSA is sat
[2016-12-30 20:39:15,767 INFO  L204        PluginConnector]: Adding new model de.uni_freiburg.informatik.ultimate.plugins.generator.buchiautomizer CFG 30.12 08:39:15 BoogieIcfgContainer
[2016-12-30 20:39:15,767 INFO  L134        PluginConnector]: ------------------------ END BuchiAutomizer----------------------------
[2016-12-30 20:39:15,768 INFO  L168              Benchmark]: Toolchain (without parser) took 884,64 ms. Allocated memory is still 1,0 GB. Free memory was 985,1 MB in the beginning and 948,6 MB in the end (delta: 36,5 MB). Peak memory consumption was 36,5 MB. Max. memory is 11,5 GB.
[2016-12-30 20:39:15,771 INFO  L168              Benchmark]: CDTParser took 143,41 ms. Allocated memory is still 1,0 GB. Free memory is still 985,1 MB. There was no memory consumed. Max. memory is 11,5 GB.
[2016-12-30 20:39:15,772 INFO  L168              Benchmark]: CACSL2BoogieTranslator took 268,48 ms. Allocated memory is still 1,0 GB. Free memory was 985,1 MB in the beginning and 979,7 MB in the end (delta: 5,4 MB). Peak memory consumption was 5,4 MB. Max. memory is 11,5 GB.
[2016-12-30 20:39:15,773 INFO  L168              Benchmark]: Boogie Procedure Inliner took 26,64 ms. Allocated memory is still 1,0 GB. Free memory was 979,7 MB in the beginning and 974,4 MB in the end (delta: 5,4 MB). Peak memory consumption was 5,4 MB. Max. memory is 11,5 GB.
[2016-12-30 20:39:15,774 INFO  L168              Benchmark]: Boogie Preprocessor took 13,22 ms. Allocated memory is still 1,0 GB. Free memory is still 974,4 MB. There was no memory consumed. Max. memory is 11,5 GB.
[2016-12-30 20:39:15,775 INFO  L168              Benchmark]: RCFGBuilder took 184,95 ms. Allocated memory is still 1,0 GB. Free memory was 974,4 MB in the beginning and 959,3 MB in the end (delta: 15,0 MB). Peak memory consumption was 15,0 MB. Max. memory is 11,5 GB.
[2016-12-30 20:39:15,776 INFO  L168              Benchmark]: BuchiAutomizer took 386,20 ms. Allocated memory is still 1,0 GB. Free memory was 959,3 MB in the beginning and 948,6 MB in the end (delta: 10,7 MB). Peak memory consumption was 10,7 MB. Max. memory is 11,5 GB.
[2016-12-30 20:39:15,782 INFO  L303   ainManager$Toolchain]: #######################  End [Toolchain 1] #######################
 --- Results ---
 * Results from de.uni_freiburg.informatik.ultimate.plugins.generator.buchiautomizer:
  - BenchmarkResult: Constructed decomposition of program
    Trivial decomposition into one nonterminating module.
  - BenchmarkResult: Timing statistics
    BüchiAutomizer plugin needed 0.3s and 1 iterations. Analysis of lassos took 0.2s. Construction of modules took 0.0s. Büchi inclusion checks took 0.0s. Highest rank in rank-based complementation 0. Minimization of det autom 0. Minimization of nondet autom 0. Automata minimization No data available. Non-live state removal took 0.0s Buchi closure took 0.0s. Biggest automaton had -1 states and ocurred in iteration -1.	Nontrivial modules had stage [0, 0, 0, 0, 0].	InterpolantCoveringCapabilityFinite: 0/0	InterpolantCoveringCapabilityBuchi: 0/0	HoareTripleCheckerStatistics: No data available	LassoAnalysisResults: nont1 unkn0 SFLI0 SFLT0 conc0 concLT0 SILN0 SILU0 SILI0 SILT0 lasso0 LassoPreprocessingBenchmarks: LassoTerminationAnalysisBenchmarks: not availableLassoTerminationAnalysisBenchmarks: LassoNonterminationAnalysisSat: 0	LassoNonterminationAnalysisUnsat: 0	LassoNonterminationAnalysisUnknown: 0	LassoNonterminationAnalysisTime: 0.0s	
  - TerminationAnalysisResult: Nontermination possible
    Buchi Automizer proved that your program is nonterminating for some inputs
  - FixpointNonTerminationResult [Line: 10]: Nontermination argument in form of an infinite program execution.
    Nontermination argument in form of an infinite execution
State at position 0 is
{}
State at position 1 is
{org.eclipse.cdt.internal.core.dom.parser.c.CASTFunctionCallExpression@57305199=0, \result=0}
  - BenchmarkResult: NonterminationBenchmark
    Fixpoint
  - NonterminatingLassoResult [Line: 10]: Nonterminating execution
    Found a nonterminating execution for the following lasso shaped sequence of statements.
Stem:
[L9]        int a[1048];
Loop:
[L10]  EXPR       a[2]
[L10]  COND TRUE  a[2] >= 0
[L11]  EXPR       a[2]
[L11]  EXPR       a[2]
[L11]             a[2] = a[2] - 1
[L12]  EXPR       a[1+1]
[L12]             a[1+1] = __VERIFIER_nondet_int()
End of lasso representation.
 * Results from UltimateCore:
  - BenchmarkResult: Toolchain Benchmarks
    Benchmark results are:
 * CDTParser took 143,41 ms. Allocated memory is still 1,0 GB. Free memory is still 985,1 MB. There was no memory consumed. Max. memory is 11,5 GB.
 * CACSL2BoogieTranslator took 268,48 ms. Allocated memory is still 1,0 GB. Free memory was 985,1 MB in the beginning and 979,7 MB in the end (delta: 5,4 MB). Peak memory consumption was 5,4 MB. Max. memory is 11,5 GB.
 * Boogie Procedure Inliner took 26,64 ms. Allocated memory is still 1,0 GB. Free memory was 979,7 MB in the beginning and 974,4 MB in the end (delta: 5,4 MB). Peak memory consumption was 5,4 MB. Max. memory is 11,5 GB.
 * Boogie Preprocessor took 13,22 ms. Allocated memory is still 1,0 GB. Free memory is still 974,4 MB. There was no memory consumed. Max. memory is 11,5 GB.
 * RCFGBuilder took 184,95 ms. Allocated memory is still 1,0 GB. Free memory was 974,4 MB in the beginning and 959,3 MB in the end (delta: 15,0 MB). Peak memory consumption was 15,0 MB. Max. memory is 11,5 GB.
 * BuchiAutomizer took 386,20 ms. Allocated memory is still 1,0 GB. Free memory was 959,3 MB in the beginning and 948,6 MB in the end (delta: 10,7 MB). Peak memory consumption was 10,7 MB. Max. memory is 11,5 GB.
RESULT: Ultimate could not prove your program: Toolchain returned no result.
[2016-12-30 20:39:15,801 INFO  L95        ToolchainStorage]: Clearing 9 storables from ToolchainStorage
[2016-12-30 20:39:15,804 INFO  L166           UltimateCore]: Preparing to exit Ultimate with return code 0
[2016-12-30 20:39:15,805 INFO  L95        ToolchainStorage]: Clearing 1 storables from ToolchainStorage
Received shutdown request...
